{
  "schemaVersion": 1,
  "id": "package-c01-4bb110167b1d9a963dfc04de",
  "jobId": "c01-4bb110167b1d9a963dfc04de",
  "worker": {
    "id": "campaign-research",
    "specialism": "entity-core"
  },
  "productionFingerprint": "397c700dd6f26dab73bd12c6fce8525fa99588437175cf13e4679b67be235f66",
  "entityId": "mexico-1917-constitutional-framework",
  "mapIds": [
    "entity-mexico"
  ],
  "period": {
    "from": "1918",
    "until": "1934"
  },
  "category": "core-state",
  "categories": [
    "capital",
    "leadership",
    "political-institutional",
    "currency"
  ],
  "claims": [
    {
      "id": "c01-mexico-obregon",
      "category": "leadership",
      "value": "Álvaro Obregón",
      "role": "President",
      "temporal": {
        "kind": "interval",
        "from": "1920-12-01",
        "until": "1924-12-01"
      },
      "entityId": "mexico-1917-constitutional-framework",
      "geographicScope": {
        "description": "Historical central office of Mexico — 1917 constitutional framework; no inference of uniform territorial authority",
        "relationship": "same"
      },
      "sourceIds": [
        "c01-inehrm-gobierno"
      ],
      "evidence": [
        {
          "sourceId": "c01-inehrm-gobierno",
          "note": "Monograph pp60–61 explicitly gives1December1920–30November1924. Inclusivefinalday represented by exclusive1December1924.",
          "supportedPrecision": "day",
          "supportsClaim": true,
          "from": "1920-12-01",
          "until": "1924-12-01"
        }
      ],
      "reviewStatus": "clear",
      "cautions": []
    },
    {
      "id": "c01-mexico-calles",
      "category": "leadership",
      "value": "Plutarco Elías Calles",
      "role": "President",
      "temporal": {
        "kind": "interval",
        "from": "1924-12-01",
        "until": "1928-12-01"
      },
      "entityId": "mexico-1917-constitutional-framework",
      "geographicScope": {
        "description": "Historical central office of Mexico — 1917 constitutional framework; no inference of uniform territorial authority",
        "relationship": "same"
      },
      "sourceIds": [
        "c01-inehrm-gobierno"
      ],
      "evidence": [
        {
          "sourceId": "c01-inehrm-gobierno",
          "note": "Monograph p65 explicitly gives1December1924–30November1928. LaterMaximatoinfluenceisnotpresidentialoffice.",
          "supportedPrecision": "day",
          "supportsClaim": true,
          "from": "1924-12-01",
          "until": "1928-12-01"
        }
      ],
      "reviewStatus": "clear",
      "cautions": []
    },
    {
      "id": "c01-mexico-portes",
      "category": "leadership",
      "value": "Emilio Portes Gil",
      "role": "Provisional President",
      "temporal": {
        "kind": "interval",
        "from": "1928-12-01",
        "until": "1930-02-05"
      },
      "entityId": "mexico-1917-constitutional-framework",
      "geographicScope": {
        "description": "Historical central office of Mexico — 1917 constitutional framework; no inference of uniform territorial authority",
        "relationship": "same"
      },
      "sourceIds": [
        "c01-inehrm-gobierno"
      ],
      "evidence": [
        {
          "sourceId": "c01-inehrm-gobierno",
          "note": "Monograph p71 dates provisionalpresidency1December1928–4February1930; exclusiveend5February1930.",
          "supportedPrecision": "day",
          "supportsClaim": true,
          "from": "1928-12-01",
          "until": "1930-02-05"
        }
      ],
      "reviewStatus": "clear",
      "cautions": []
    }
  ],
  "sources": [
    {
      "id": "c01-inehrm-gobierno",
      "title": "Gobierno: México y la Constitución de1917",
      "institution": "INEHRM, Senate of Mexico and UNAM; Alejandro Carrillo Castro",
      "url": "https://www.inehrm.gob.mx/recursos/Libros/Gobierno.pdf",
      "usage": "Read monograph bodypp60–65and71–73; selected office chronology only; conflictingRodríguez1932monthnotimported.",
      "kind": "academic",
      "accessed": "2026-10-01"
    }
  ],
  "absenceOfEvidence": [
    "1918–1920 and1930–1934leadershipnotcompleted; no substitute guessedofficeholders.",
    "Currency not sourced by the office chronology."
  ],
  "reviewNotes": [
    "Existingcapital andconstitutionalcore unchanged.",
    "Provisional andconstitutionalpresidentialrolesretained; no claim thatCallesremainedPresidentthroughMaximato.",
    "RodríguezheaderNovember1932 versus usualSeptember requiresindependentreview; omitted ratherthanimported."
  ]
}
