{
  "schemaVersion": 1,
  "id": "package-c01-5d876ff18ab3793109c1b93f",
  "jobId": "c01-5d876ff18ab3793109c1b93f",
  "worker": {
    "id": "campaign-design",
    "specialism": "entity-core"
  },
  "productionFingerprint": "397c700dd6f26dab73bd12c6fce8525fa99588437175cf13e4679b67be235f66",
  "entityId": "british-raj",
  "mapIds": [
    "entity-british-raj"
  ],
  "period": {
    "from": "1859",
    "until": "1910"
  },
  "category": "core-state",
  "categories": [
    "capital",
    "leadership",
    "political-institutional",
    "currency"
  ],
  "claims": [
    {
      "id": "c01-raj-calcutta-capital",
      "category": "capital",
      "value": "Calcutta (central colonial administrative capital)",
      "temporal": {
        "kind": "interval",
        "from": "1859",
        "until": "1910"
      },
      "entityId": "british-raj",
      "geographicScope": {
        "description": "British Raj; institutional office or administrative seat, not a claim of uniform sovereignty or direct control over all polygon territory.",
        "relationship": "same"
      },
      "sourceIds": [
        "raj-capital",
        "c01-raj-kmc-capital-history",
        "c01-raj-kmc-capital-end"
      ],
      "evidence": [
        {
          "sourceId": "raj-capital",
          "note": "Joint chronological evidence: KMC municipal history establishes capital status1773 before assigned1859start; KMC historical introduction explicitly says British Raj capital until1911; NDMC describes1911transfer. Together support bounded1859–1910; NDMC alone is not proof of1859start. No modern statistics, foundation-date precision or uniform direct administration claim.",
          "supportedPrecision": "year",
          "supportsClaim": true,
          "from": "1859",
          "until": "1910"
        },
        {
          "sourceId": "c01-raj-kmc-capital-history",
          "note": "Joint chronological evidence: KMC municipal history establishes capital status1773 before assigned1859start; KMC historical introduction explicitly says British Raj capital until1911; NDMC describes1911transfer. Together support bounded1859–1910; NDMC alone is not proof of1859start. No modern statistics, foundation-date precision or uniform direct administration claim.",
          "supportedPrecision": "year",
          "supportsClaim": true,
          "from": "1859",
          "until": "1910"
        },
        {
          "sourceId": "c01-raj-kmc-capital-end",
          "note": "Joint chronological evidence: KMC municipal history establishes capital status1773 before assigned1859start; KMC historical introduction explicitly says British Raj capital until1911; NDMC describes1911transfer. Together support bounded1859–1910; NDMC alone is not proof of1859start. No modern statistics, foundation-date precision or uniform direct administration claim.",
          "supportedPrecision": "year",
          "supportsClaim": true,
          "from": "1859",
          "until": "1910"
        }
      ],
      "reviewStatus": "clear",
      "cautions": []
    }
  ],
  "sources": [
    {
      "id": "c01-raj-kmc-capital-history",
      "title": "About Kolkata — municipal history",
      "institution": "Kolkata Municipal Corporation",
      "url": "https://www.kmcgov.in/KMCPortal/jsp/KMCAboutKolkataHome.jsp",
      "accessed": "2026-10-01",
      "kind": "official-institutional",
      "usage": "Read municipal historical body: capital elevation1773 and nineteenth-century administrative chronology; combined with municipal1911endstatement, not a new foundation-date claim."
    },
    {
      "id": "c01-raj-kmc-capital-end",
      "title": "Basic Statistics of Kolkata — historical capital introduction",
      "institution": "Kolkata Municipal Corporation",
      "url": "https://www.kmcgov.in/KMCPortal/jsp/KolkataStatistics.jsp",
      "accessed": "2026-10-01",
      "kind": "official-institutional",
      "usage": "Read introductory historical statement identifying Calcutta as British Raj capital until1911. Modern2001statistics excluded."
    }
  ],
  "absenceOfEvidence": [
    "The complete viceroy chronology and pre-1935 currency validity need dedicated evidence; existing later-year facts are preserved."
  ],
  "reviewNotes": [
    "Independent body evidence reviewed. Package uses original assigned context; coordinator must revalidate against current production before integration.",
    "Repaired after review using two independently read municipal capital-history bodies; original package archived in preliminary/revisions."
  ]
}
