{
  "schemaVersion": 1,
  "id": "package-c01-483121e436d21666af58db07",
  "jobId": "c01-483121e436d21666af58db07",
  "worker": {
    "id": "campaign-design",
    "specialism": "entity-core"
  },
  "productionFingerprint": "397c700dd6f26dab73bd12c6fce8525fa99588437175cf13e4679b67be235f66",
  "entityId": "austria-first-republic-framework",
  "mapIds": [
    "entity-austria"
  ],
  "period": {
    "from": "1919",
    "until": "1932"
  },
  "category": "core-state",
  "categories": [
    "capital",
    "leadership",
    "political-institutional",
    "currency"
  ],
  "claims": [
    {
      "id": "c01-austria-seitz-head",
      "category": "leadership",
      "value": "Karl Seitz",
      "temporal": {
        "kind": "interval",
        "from": "1919",
        "until": "1920-12-09"
      },
      "entityId": "austria-first-republic-framework",
      "geographicScope": {
        "description": "Austria — First Republic; institutional office or administrative seat, not a claim of uniform sovereignty or direct control over all polygon territory.",
        "relationship": "same"
      },
      "sourceIds": [
        "c01-austria-presidents-history"
      ],
      "evidence": [
        {
          "sourceId": "c01-austria-presidents-history",
          "note": "Presidential Chancellery describes Seitz as head of state through 9 December 1920; he is not called federal president. Claim begins in assigned 1919.",
          "supportedPrecision": "day",
          "supportsClaim": true,
          "from": "1919",
          "until": "1920-12-09"
        }
      ],
      "reviewStatus": "clear",
      "cautions": [],
      "role": "Head of state"
    },
    {
      "id": "c01-austria-hainisch-president",
      "category": "leadership",
      "value": "Michael Hainisch",
      "temporal": {
        "kind": "interval",
        "from": "1920-12-09",
        "until": "1928-12-10"
      },
      "entityId": "austria-first-republic-framework",
      "geographicScope": {
        "description": "Austria — First Republic; institutional office or administrative seat, not a claim of uniform sovereignty or direct control over all polygon territory.",
        "relationship": "same"
      },
      "sourceIds": [
        "c01-austria-presidents-history"
      ],
      "evidence": [
        {
          "sourceId": "c01-austria-presidents-history",
          "note": "Official body gives two successive presidential terms from 9 December 1920 through 10 December 1928.",
          "supportedPrecision": "day",
          "supportsClaim": true,
          "from": "1920-12-09",
          "until": "1928-12-10"
        }
      ],
      "reviewStatus": "clear",
      "cautions": [],
      "role": "Federal President"
    },
    {
      "id": "c01-austria-miklas-president",
      "category": "leadership",
      "value": "Wilhelm Miklas",
      "temporal": {
        "kind": "interval",
        "from": "1928-12-10",
        "until": "1932"
      },
      "entityId": "austria-first-republic-framework",
      "geographicScope": {
        "description": "Austria — First Republic; institutional office or administrative seat, not a claim of uniform sovereignty or direct control over all polygon territory.",
        "relationship": "same"
      },
      "sourceIds": [
        "c01-austria-presidents-history"
      ],
      "evidence": [
        {
          "sourceId": "c01-austria-presidents-history",
          "note": "Official body dates Miklas presidency from 10 December 1928 to March 1938; claim stops at assigned 1932 bound and does not merge later authoritarian framework.",
          "supportedPrecision": "day",
          "supportsClaim": true,
          "from": "1928-12-10",
          "until": "1932"
        }
      ],
      "reviewStatus": "clear",
      "cautions": [],
      "role": "Federal President"
    },
    {
      "id": "c01-austria-schilling-currency",
      "category": "currency",
      "value": "Austrian schilling",
      "temporal": {
        "kind": "interval",
        "from": "1926",
        "until": "1932"
      },
      "entityId": "austria-first-republic-framework",
      "geographicScope": {
        "description": "Austria — First Republic; institutional office or administrative seat, not a claim of uniform sovereignty or direct control over all polygon territory.",
        "relationship": "same"
      },
      "sourceIds": [
        "c01-austria-oenb-schilling-history"
      ],
      "evidence": [
        {
          "sourceId": "c01-austria-oenb-schilling-history",
          "note": "OeNB body states schilling replaced crown in 1925 and remained currency through 1938. Claim begins in 1926 to exclude conflicting January/March 1925 legal/operational commencement accounts.",
          "supportedPrecision": "year",
          "supportsClaim": true,
          "from": "1926",
          "until": "1932"
        }
      ],
      "reviewStatus": "clear",
      "cautions": []
    }
  ],
  "sources": [
    {
      "id": "c01-austria-presidents-history",
      "title": "Kennen Sie die bisherigen Amtsinhaber? — First Republic",
      "institution": "Austrian Presidential Chancellery",
      "url": "https://www.bundespraesident.at/aktuelles/detail/bisherige-amtsinhaber",
      "accessed": "2026-10-01",
      "kind": "official-institutional",
      "usage": "Read First Republic body: Seitz head of state through 9 December 1920; Hainisch president 9 December 1920–10 December 1928; Miklas 10 December 1928–13 March 1938. Different institutional titles preserved."
    },
    {
      "id": "c01-austria-oenb-schilling-history",
      "title": "OeNB history — First Republic currency and crisis management",
      "institution": "Oesterreichische Nationalbank",
      "url": "https://www.oenb.at/en/die-oenb/geschichte-der-oenb/unternehmensgeschichte.html",
      "accessed": "2026-10-01",
      "kind": "official-institutional",
      "usage": "Read currency reform and crisis-management body: schilling replaced crown in 1925 and remained stable up to 1938. Conflicting official January/March 1925 commencement dates omitted by starting safely in 1926."
    }
  ],
  "absenceOfEvidence": [
    "1925 currency commencement details require review: official OeNB history says January; anniversary releases say March. No precise contested transition claim integrated.",
    "Capital interval not researched adequately; existing constitutional facts are preserved."
  ],
  "reviewNotes": [
    "Independent body evidence reviewed. Package uses original assigned context; coordinator must revalidate against current production before integration."
  ]
}
