{
  "schemaVersion": 1,
  "id": "package-c01-0e39da57777747632a561c20",
  "jobId": "c01-0e39da57777747632a561c20",
  "worker": {
    "id": "campaign-research",
    "specialism": "entity-core"
  },
  "productionFingerprint": "397c700dd6f26dab73bd12c6fce8525fa99588437175cf13e4679b67be235f66",
  "entityId": "chile-restored-presidential-framework",
  "mapIds": [
    "entity-chile"
  ],
  "period": {
    "from": "1933",
    "until": "1952"
  },
  "category": "core-state",
  "categories": [
    "capital",
    "leadership",
    "political-institutional",
    "currency"
  ],
  "claims": [
    {
      "id": "c01-chile-alessandri",
      "category": "leadership",
      "value": "Arturo Alessandri Palma",
      "role": "President",
      "temporal": {
        "kind": "interval",
        "from": "1933",
        "until": "1937"
      },
      "entityId": "chile-restored-presidential-framework",
      "geographicScope": {
        "description": "Historical central office associated with this framework; not proof of uniform authority over map geometry",
        "relationship": "same"
      },
      "sourceIds": [
        "b09-chile-1925"
      ],
      "evidence": [
        {
          "sourceId": "b09-chile-1925",
          "note": "Read parliamentary historical account: presidential terms are stated at year precision. Claim uses only interior complete years; transition years and interim arrangements remain explicit gaps.",
          "supportedPrecision": "year",
          "supportsClaim": true,
          "from": "1932",
          "until": "1938"
        }
      ],
      "reviewStatus": "clear",
      "cautions": []
    },
    {
      "id": "c01-chile-aguirre",
      "category": "leadership",
      "value": "Pedro Aguirre Cerda",
      "role": "President",
      "temporal": {
        "kind": "interval",
        "from": "1939",
        "until": "1940"
      },
      "entityId": "chile-restored-presidential-framework",
      "geographicScope": {
        "description": "Historical central office associated with this framework; not proof of uniform authority over map geometry",
        "relationship": "same"
      },
      "sourceIds": [
        "b09-chile-1925"
      ],
      "evidence": [
        {
          "sourceId": "b09-chile-1925",
          "note": "Read parliamentary historical account: presidential terms are stated at year precision. Claim uses only interior complete years; transition years and interim arrangements remain explicit gaps.",
          "supportedPrecision": "year",
          "supportsClaim": true,
          "from": "1938",
          "until": "1941"
        }
      ],
      "reviewStatus": "clear",
      "cautions": []
    },
    {
      "id": "c01-chile-rios",
      "category": "leadership",
      "value": "Juan Antonio Ríos",
      "role": "President",
      "temporal": {
        "kind": "interval",
        "from": "1943",
        "until": "1945"
      },
      "entityId": "chile-restored-presidential-framework",
      "geographicScope": {
        "description": "Historical central office associated with this framework; not proof of uniform authority over map geometry",
        "relationship": "same"
      },
      "sourceIds": [
        "b09-chile-1925"
      ],
      "evidence": [
        {
          "sourceId": "b09-chile-1925",
          "note": "Read parliamentary historical account: presidential terms are stated at year precision. Claim uses only interior complete years; transition years and interim arrangements remain explicit gaps.",
          "supportedPrecision": "year",
          "supportsClaim": true,
          "from": "1942",
          "until": "1946"
        }
      ],
      "reviewStatus": "clear",
      "cautions": []
    },
    {
      "id": "c01-chile-gonzalez",
      "category": "leadership",
      "value": "Gabriel González Videla",
      "role": "President",
      "temporal": {
        "kind": "interval",
        "from": "1947",
        "until": "1951"
      },
      "entityId": "chile-restored-presidential-framework",
      "geographicScope": {
        "description": "Historical central office associated with this framework; not proof of uniform authority over map geometry",
        "relationship": "same"
      },
      "sourceIds": [
        "b09-chile-1925"
      ],
      "evidence": [
        {
          "sourceId": "b09-chile-1925",
          "note": "Read parliamentary historical account: presidential terms are stated at year precision. Claim uses only interior complete years; transition years and interim arrangements remain explicit gaps.",
          "supportedPrecision": "year",
          "supportsClaim": true,
          "from": "1946",
          "until": "1952"
        }
      ],
      "reviewStatus": "clear",
      "cautions": []
    }
  ],
  "sources": [],
  "absenceOfEvidence": [
    "No sufficiently reviewed period-specific capital or currency package prepared."
  ],
  "reviewNotes": [
    "Existing constitutional facts preserved. Transition years 1938, 1941–1942, 1946 and 1952 intentionally unfilled; year-only evidence is not converted to an exact inauguration date."
  ]
}
